Centro Operativo;Código TdC;Número de incidencia;Estado TDC;Municipio;DIRECCION;Fecha de Inicio de Ejecución de Trabajo;Fecha de fin;Código Causa;Descripción Causa;Observaciones de campo;REVISAR?;ESTADO_OCA;CLIENTE_SE_ENCUENTRA;ZONAL;GESTOR;ITO_OCA;FECHA_ASIGNADA_OCA;FECHA_INSPECCION_OCA;DIAS_LAB_DESDE_ASIGNACIÓN;MES;AÑO
EMERG_ENEL_BUREAU_VERITAS_FLO;8418922;DF20227302381;Finalizado;SAN RAMÓN;MAYO 1600 ;01/03/2022 20:29;01/03/2022 20:46;GB;SERVIDUMBRE ARBOLES;"Verifica acometida concentrica desprendida de fachada domicilio. Normaliza sin gastos. Además verifica conexiones sueltas en red tradicional. Normaliza puente fase roja y otros 2 empalmes, sin gastos.
En red BT se registraron voltajes normales, 380 (V) entre fases y 220 (V) fase y neutro. ";SI;PENDIENTE;PENDIENTE EJECUCIÓN;Florida;Marcelo Alvarez;PENDIENTE EJECUCIÓN;21-03-2022;PENDIENTE EJECUCIÓN;3;PENDIENTE EJECUCIÓN;2022
EMERG_ENEL_BUREAU_VERITAS_FLO;8431021;DF20227304004;Finalizado;SAN RAMÓN;ANTARTICA CHILENA 1845 ;04/03/2022 16:49;04/03/2022 17:15;29;OTRAS CAUSAS PROPIAS EXTERNAS;cliente con conexión suelta en regleta de caja DAE se normaliza y reajustan chicotes de alimentación a caja quedando domicilio con servicio normal se toman variables de 224v y 12amp. no se toman fotos por zona conflictiva personas no gratas en el lugar.;SI;PENDIENTE;PENDIENTE EJECUCIÓN;Florida;Marcelo Alvarez;PENDIENTE EJECUCIÓN;21-03-2022;PENDIENTE EJECUCIÓN;3;PENDIENTE EJECUCIÓN;2022
EMERG_ENEL_BUREAU_VERITAS_FLO;8431432;DF20227304559;Finalizado;SAN RAMÓN;VICUNA MACKENNA 1719 ;05/03/2022 09:28;05/03/2022 10:05;68;VEHICULOS-ACCIDENTAL;se encuentra acometida concentrica que va del medidor hacia la UT cortado por cable telefónico que fue desprendido por paso de camión carga alta, se procede normalizar conectando nuevamente la acometida y se le hace reapriete a las conexiones de la acometida en regleta caja aérea y  al chicote principal que  alimenta la caja quedando domicilio con servicio normal y conforme, se registra carga en chicote principal teniendo 9amp.;SI;PENDIENTE;PENDIENTE EJECUCIÓN;Florida;Marcelo Alvarez;PENDIENTE EJECUCIÓN;21-03-2022;PENDIENTE EJECUCIÓN;3;PENDIENTE EJECUCIÓN;2022
EMERG_ENEL_BUREAU_VERITAS_FLO;8431544;DF20227304661;Finalizado;SAN RAMÓN;ALPATACAL 2241 A ;05/03/2022 16:15;05/03/2022 16:44;29;OTRAS CAUSAS PROPIAS EXTERNAS;Se verifica ITM de 10amp en mal estado se normaliza con uno de 1x16amp y se reajustan conexiones en caja DAE y chicotes de alimentación quedando domicilio con servicio normal tomando variables FAyFR:386v FAyFB:387v FByFR:386v FA:5amp FB:4amp FR:5amp.;SI;PENDIENTE;PENDIENTE EJECUCIÓN;Florida;Marcelo Alvarez;PENDIENTE EJECUCIÓN;21-03-2022;PENDIENTE EJECUCIÓN;3;PENDIENTE EJECUCIÓN;2022
EMERG_ENEL_BUREAU_VERITAS_FLO;8431720;DF20227304785;Finalizado;SAN RAMÓN;ALPATACAL 1766 ;05/03/2022 17:28;05/03/2022 17:51;85;CLIENTE;Se normaliza fase y neutro suelto en ut quedando cliente con servicio normal y con un voltaje de 222 volts ;SI;PENDIENTE;PENDIENTE EJECUCIÓN;Florida;Marcelo Alvarez;PENDIENTE EJECUCIÓN;21-03-2022;PENDIENTE EJECUCIÓN;3;PENDIENTE EJECUCIÓN;2022
EMERG_ENEL_BUREAU_VERITAS_FLO;8442483;DF20227306721;Finalizado;SAN RAMÓN;CRUZ DEL SUR 1909 ;09/03/2022 13:35;09/03/2022 14:15;85;CLIENTE;Se normaliza fase y neutro fundido de alimentación a regleta y se reapretan conexión en caja dae dm003 10 cliente afectado. Quedando cliente con servicio normal y con un voltaje de 215 volts y una carga 25a ;SI;PENDIENTE;PENDIENTE EJECUCIÓN;Florida;Marcelo Alvarez;PENDIENTE EJECUCIÓN;21-03-2022;PENDIENTE EJECUCIÓN;3;PENDIENTE EJECUCIÓN;2022
EMERG_ENEL_BUREAU_VERITAS_FLO;8452605;DF20227307904;Finalizado;SAN RAMÓN;CARLOS CARIOLA 1460 ;11/03/2022 11:47;11/03/2022 12:04;06;FALTA MANTENIMIENTO;se reacondiciona fase fundida y se reapreta linea concentrica de distribución en regleta de caja dms03 y se hace medición fase y neutro 220 volt,  y se verifica cliente con servicio normal. ;SI;PENDIENTE;PENDIENTE EJECUCIÓN;Florida;Marcelo Alvarez;PENDIENTE EJECUCIÓN;21-03-2022;PENDIENTE EJECUCIÓN;3;PENDIENTE EJECUCIÓN;2022
EMERG_ENEL_BUREAU_VERITAS_FLO;8455380;DF20227308521;Finalizado;SAN RAMÓN;RIO SAN LORENSO 2084 ;12/03/2022 19:30;12/03/2022 19:59;49;OTRAS CAUSAS ATMOSFERICAS;se encontró fase escoriada en caja dae , se conecta quedando suministro eléctrico normalizado,  se reapretan cnx en regleta , se reacondiciona alimentación caja dae, se verifica variables AB 372 , AR 373 , BR 375 V , NA 212 , NB 214 , NR 216 V , R 45 , B 21 , A 39 AMP ;SI;PENDIENTE;PENDIENTE EJECUCIÓN;Florida;Marcelo Alvarez;PENDIENTE EJECUCIÓN;21-03-2022;PENDIENTE EJECUCIÓN;3;PENDIENTE EJECUCIÓN;2022
EMERG_ENEL_BUREAU_VERITAS_FLO;8455610;DF20227308742;Finalizado;SAN RAMÓN;LOS PINOS 9846 ;13/03/2022 16:47;13/03/2022 17:19;29;OTRAS CAUSAS PROPIAS EXTERNAS;Cable de distribución concentrico en cortocircuito en caja DAE afectando 8 domicilio aprox se normaliza y reajustan chicotes de alimentación a caja DAE quedando clientes con servicio normal tomando variables FAyFR:390v FAyFB:389v FByFR:392v FA:7amp FB:6amp FR:8amp ;SI;PENDIENTE;PENDIENTE EJECUCIÓN;Florida;Marcelo Alvarez;PENDIENTE EJECUCIÓN;21-03-2022;PENDIENTE EJECUCIÓN;3;PENDIENTE EJECUCIÓN;2022
EMERG_ENEL_BUREAU_VERITAS_FLO;8455993;DF20227309064;Finalizado;SAN RAMÓN;ANA MARIA 7245 ;14/03/2022 11:55;14/03/2022 12:40;85;CLIENTE;se verifica acometida concentrica destemplada x camión carga alta , se realiza reaprete de conexiones, mantenimiento preventivo en red,en conectoras, voltajes 386. 388. 389 carga 3A. 5A. 9A  reacondiciona UT mal estado se aísla cable telefónico y TV;SI;PENDIENTE;PENDIENTE EJECUCIÓN;Florida;Marcelo Alvarez;PENDIENTE EJECUCIÓN;21-03-2022;PENDIENTE EJECUCIÓN;3;PENDIENTE EJECUCIÓN;2022
EMERG_ENEL_BUREAU_VERITAS_FLO;8458050;DF20227309311;Finalizado;SAN RAMÓN;INDEPENDENCIA 9554 ;14/03/2022 18:05;14/03/2022 18:11;19;OTRAS CAUSAS PROPIAS INTERNAS;se encuentra medidor colgando se afianza a poste de madera quedando cliente conforme  y medidor normal;SI;PENDIENTE;PENDIENTE EJECUCIÓN;Florida;Marcelo Alvarez;PENDIENTE EJECUCIÓN;21-03-2022;PENDIENTE EJECUCIÓN;3;PENDIENTE EJECUCIÓN;2022
EMERG_ENEL_BUREAU_VERITAS_FLO;8459020;DF20227309685;Finalizado;SAN RAMÓN;CRUZ DEL SUR 1861 ;15/03/2022 08:01;15/03/2022 08:49;06;FALTA MANTENIMIENTO;de verifica  domicilio  sin servicio, corresponde  a conexión  fundida en regleta, se repara, además se reacondiciona  alimentación  a caja DAE  y se toman las variables 224V y carga:16A quedando  cliente con servicio normal .;SI;PENDIENTE;PENDIENTE EJECUCIÓN;Florida;Marcelo Alvarez;PENDIENTE EJECUCIÓN;21-03-2022;PENDIENTE EJECUCIÓN;3;PENDIENTE EJECUCIÓN;2022
EMERG_ENEL_BUREAU_VERITAS_FLO;8459054;DF20227309698;Finalizado;SAN RAMÓN;CRUZ DEL SUR 1854 ;15/03/2022 09:42;15/03/2022 09:56;29;OTRAS CAUSAS PROPIAS EXTERNAS;se verifica ITM de 1x100A operado del td DAE 21645 por chicote de alimentacion del mismo a regleta fundido afectando la acometidas del domicilio 1854 ,1856 y 1857 la cual se normaliza quedando sector con servicio normal, se toman variables 228V y cargas 76A ;SI;PENDIENTE;PENDIENTE EJECUCIÓN;Florida;Marcelo Alvarez;PENDIENTE EJECUCIÓN;21-03-2022;PENDIENTE EJECUCIÓN;3;PENDIENTE EJECUCIÓN;2022
EMERG_ENEL_BUREAU_VERITAS_FLO;8459192;DF20227309741;Finalizado;SAN RAMÓN;CRUZ DEL SUR 1865 ;15/03/2022 10:38;15/03/2022 11:02;BW;FALLA ACOMETIDA;cliente sin servicio se encuentra fase azul conexión suelta en regleta la cual se reacondiciona al igual que alimentacion de caja dae quedando domicilio con servicio normal, se toman variables A-B 380V A-R 397 Y B-R 380V A-N226V B-N212V Y R-N220V CARGAS A 45A B 44A Y R40A;SI;PENDIENTE;PENDIENTE EJECUCIÓN;Florida;Marcelo Alvarez;PENDIENTE EJECUCIÓN;21-03-2022;PENDIENTE EJECUCIÓN;3;PENDIENTE EJECUCIÓN;2022
EMERG_ENEL_BUREAU_VERITAS_FLO;8470040;DF20227311964;Finalizado;SAN RAMÓN;SAN FRANCISCO 9901 ;18/03/2022 05:13;18/03/2022 06:05;85;CLIENTE;San Francisco 9891 y 9901 se reparan provisorias acom.conc.cortadas ,por,, vehículo carga alta ,se reapretan conexiones de alimentación a regleta, se registra voltaje y carga en la red, entre fases 385 v neutro y fase A 220 v B 222 v R 223 v ,carga A 65 B 58 R 50 amp. domicilios con servicio normal. se ocupan 25 metros de concentrico 4 mm.;SI;PENDIENTE;PENDIENTE EJECUCIÓN;Florida;Marcelo Alvarez;PENDIENTE EJECUCIÓN;21-03-2022;PENDIENTE EJECUCIÓN;3;PENDIENTE EJECUCIÓN;2022
EMERG_ENEL_BUREAU_VERITAS_FLO;8470584;DF20227312060;Finalizado;SAN RAMÓN;BARCELO LIRA 1630 BL 13 DP 14  ;18/03/2022 13:46;18/03/2022 13:56;85;CLIENTE;Se normaliza ITM protección caja de empalme operado por falla interior, cliente queda con servicio.;SI;PENDIENTE;PENDIENTE EJECUCIÓN;Florida;Marcelo Alvarez;PENDIENTE EJECUCIÓN;21-03-2022;PENDIENTE EJECUCIÓN;3;PENDIENTE EJECUCIÓN;2022
EMERG_ENEL_BUREAU_VERITAS_FLO;8470586;DF20227312075;Finalizado;SAN RAMÓN;LO OVALLE 1445 ;18/03/2022 14:14;18/03/2022 14:57;69;OTRAS CAUSAS DE TERCEROS;Se verifica cliente trifásico con acometida concéntrica desaparecida, se da servicio a cliente de forma provisoria instalando acometida monofásico, se requiere 180mts aproximadamente para normalizar empalme. Cliente queda con servicio;SI;PENDIENTE;PENDIENTE EJECUCIÓN;Florida;Marcelo Alvarez;PENDIENTE EJECUCIÓN;21-03-2022;PENDIENTE EJECUCIÓN;3;PENDIENTE EJECUCIÓN;2022
EMERG_ENEL_BUREAU_VERITAS_FLO;8471553;DF20227312355;Finalizado;SAN RAMÓN;EL SALVADOR 1833 ;18/03/2022 21:02;18/03/2022 21:31;29;OTRAS CAUSAS PROPIAS EXTERNAS;acometida en cortocircuito en caja DAE se normaliza y reajustan conexiones en chicotes de alimentación a caja quedando domicilio con servicio normal se toman variables FAyFR:389v FAyFB:390v FByFR:388v FA:7amp FB:7amp FR:8amp.;SI;PENDIENTE;PENDIENTE EJECUCIÓN;Florida;Marcelo Alvarez;PENDIENTE EJECUCIÓN;21-03-2022;PENDIENTE EJECUCIÓN;3;PENDIENTE EJECUCIÓN;2022
EMERG_ENEL_BUREAU_VERITAS_FLO;8471680;DF20227312464;Finalizado;SAN RAMÓN;ANIBAL ZANARTU 10354 ;19/03/2022 08:24;19/03/2022 08:45;85;CLIENTE;se verifica acometida concentrica cortada x camión carga alta,se aísla,se realiza mantenimiento preventivo en red chicote a regleta,se toman voltaje monofásico 227 carga 6A ;SI;PENDIENTE;PENDIENTE EJECUCIÓN;Florida;Marcelo Alvarez;PENDIENTE EJECUCIÓN;21-03-2022;PENDIENTE EJECUCIÓN;3;PENDIENTE EJECUCIÓN;2022
EMERG_ENEL_BUREAU_VERITAS_FLO;8471687;DF20227312544;Finalizado;SAN RAMÓN;RAMON BARROS LUCO 10450 ;19/03/2022 09:16;19/03/2022 09:23;85;CLIENTE;cliente no decea la atención volverá a llamar mas tarde a la visita servicio okey;SI;PENDIENTE;PENDIENTE EJECUCIÓN;Florida;Marcelo Alvarez;PENDIENTE EJECUCIÓN;21-03-2022;PENDIENTE EJECUCIÓN;3;PENDIENTE EJECUCIÓN;2022
EMERG_ENEL_BUREAU_VERITAS_FLO;8472035;DF20227312996;Finalizado;SAN RAMÓN;VICUNA MACKENNA 1309 ;19/03/2022 22:06;19/03/2022 22:27;29;OTRAS CAUSAS PROPIAS EXTERNAS;se encuentra acometida concentrica con conexión fundida en regleta caja aérea, se procede a normalizar reacondicionando las conexiones de la acometida en regleta caja aérea y  se le hace reapriete a los chicote principales de la caja en red carpe en BT quedando domicilio con servicio normal y conforme, se mide carga en chicote principal de la caja teniendo F.R: 4amp, F.B: 3amp, F.A:3amp;SI;PENDIENTE;PENDIENTE EJECUCIÓN;Florida;Marcelo Alvarez;PENDIENTE EJECUCIÓN;21-03-2022;PENDIENTE EJECUCIÓN;3;PENDIENTE EJECUCIÓN;2022
EMERG_ENEL_BUREAU_VERITAS_FLO;8472132;DF20227313097;Finalizado;SAN RAMÓN;AMERICA CENTRAL 1809 ;20/03/2022 10:45;20/03/2022 11:08;85;CLIENTE;se verifica acometida concentrica conexion suelta se normaliza, además se toman voltajes 388. 389. 388 carga 4A. 5A. 9A ,se realiza mantenimiento preventivo, chicote a regleta ,se reacondiciona UT;SI;PENDIENTE;PENDIENTE EJECUCIÓN;Florida;Marcelo Alvarez;PENDIENTE EJECUCIÓN;21-03-2022;PENDIENTE EJECUCIÓN;3;PENDIENTE EJECUCIÓN;2022
EMERG_ENEL_BUREAU_VERITAS_FLO;8472190;DF20227313111;Finalizado;SAN RAMÓN;M RODRIGUEZ     1646 ;20/03/2022 13:43;20/03/2022 14:34;08;FALLO MATERIAL;Se verifica domicilio sin servicio por red BT calpe desprendido y con puentes cortados, se retensa red Calpe, se reparan puentes cortados fase Azul y neutro, se cortan ramas de árbol la cual cargaban sobre red Calpe. Sector y clientes quedan con servicio normal;SI;PENDIENTE;PENDIENTE EJECUCIÓN;Florida;Marcelo Alvarez;PENDIENTE EJECUCIÓN;21-03-2022;PENDIENTE EJECUCIÓN;3;PENDIENTE EJECUCIÓN;2022
EMERG_ENEL_BUREAU_VERITAS_FLO;8472531;DF20227313417;Finalizado;SAN RAMÓN;RIQUELME 2038 ;21/03/2022 08:03;21/03/2022 08:08;85;CLIENTE;"Se repara conexiones fundidas en UT,se reapreta conecciones en interior CE ,tapa CE sin portasello , inferior horizontal.
 ";SI;PENDIENTE;PENDIENTE EJECUCIÓN;Florida;Marcelo Alvarez;PENDIENTE EJECUCIÓN;21-03-2022;PENDIENTE EJECUCIÓN;3;PENDIENTE EJECUCIÓN;2022
